{
  "metadata": {
    "title": "Simulado de Inglês 🏀🍏",
    "description": "Simulado completo de inglês para revisão dos principais temas do bimestre: números, compras, quantidades, operações matemáticas, vocabulário de alimentos, perguntas sobre preços, leitura de diálogos e compreensão de textos curtos.",
    "subject": "Inglês",
    "grade": "5ª série",
    "topic": "Revisão geral",
    "author": "Assistente IA",
    "version": "1.0",
    "created_date": "2025-08-18"
  },
  "content": {
    "introduction": "Bem-vindo ao simulado de inglês! Responda com atenção às questões sobre números, compras, operações matemáticas, vocabulário e compreensão de textos.",
    "instructions": [
      "Leia cada questão com atenção.",
      "Marque apenas uma alternativa em cada questão de múltipla escolha.",
      "Responda as perguntas abertas em inglês.",
      "Boa sorte!"
    ],
    "sections": [
      {"name": "Big Numbers", "description": "Números grandes em inglês."},
      {"name": "Shopping and Quantities", "description": "Vocabulário de compras, quantidades e embalagens."},
      {"name": "Math Operations", "description": "Operações matemáticas em inglês."},
      {"name": "How much? How many?", "description": "Perguntas sobre preço e quantidade."},
      {"name": "Reading and Comprehension", "description": "Leitura de diálogos e compreensão de textos curtos."},
      {"name": "Vocabulary and Adjectives", "description": "Vocabulário variado e adjetivos simples."}
    ]
  },
  "questions": [
    {"id": 1, "section": "Big Numbers", "question": "What number is 'seventy-two'?", "options": ["27", "72", "17", "70"], "correct_answer": 1, "difficulty": "fácil"},
    {"id": 2, "section": "Big Numbers", "question": "How do you write 99 in English?", "options": ["Ninety-nine", "Nineteen", "Nine-nine", "Ninety-seven"], "correct_answer": 0, "difficulty": "fácil"},
    {"id": 3, "section": "Big Numbers", "question": "Write the number: eighty-six.", "options": ["86", "68", "96", "88"], "correct_answer": 0, "difficulty": "fácil"},
    {"id": 4, "section": "Big Numbers", "question": "What number is 'thirty-one'?", "options": ["13", "31", "30", "21"], "correct_answer": 1, "difficulty": "fácil"},
    {"id": 5, "section": "Big Numbers", "question": "How do you write 43 in English?", "options": ["Thirty-four", "Forty-three", "Fourteen", "Forty-four"], "correct_answer": 1, "difficulty": "fácil"},
    {"id": 6, "section": "Big Numbers", "question": "Write the number: sixty-four.", "options": ["64", "46", "60", "44"], "correct_answer": 0, "difficulty": "fácil"},
    {"id": 7, "section": "Big Numbers", "question": "What number is 'one hundred'?", "options": ["10", "100", "1,000", "1,010"], "correct_answer": 1, "difficulty": "fácil"},
    {"id": 8, "section": "Big Numbers", "question": "How do you write 55 in English?", "options": ["Fifty-five", "Fifteen", "Fifty", "Fifty-four"], "correct_answer": 0, "difficulty": "fácil"},
    {"id": 9, "section": "Big Numbers", "question": "Write the number: thirty-five.", "options": ["35", "53", "33", "55"], "correct_answer": 0, "difficulty": "fácil"},
    {"id": 10, "section": "Big Numbers", "question": "What number is 'eighty-eight'?", "options": ["88", "80", "18", "98"], "correct_answer": 0, "difficulty": "fácil"},
  {"id": 11, "section": "Big Numbers", "question": "How do you write 28 in English?", "options": ["Eighteen", "Twenty-eight", "Twenty-nine", "Twenty-three"], "correct_answer": 1, "difficulty": "fácil"},
    {"id": 12, "section": "Big Numbers", "question": "Write the number: ninety-seven.", "options": ["97", "79", "77", "99"], "correct_answer": 0, "difficulty": "fácil"},
    {"id": 13, "section": "Big Numbers", "question": "What number is 'sixty'?", "options": ["16", "60", "6", "66"], "correct_answer": 1, "difficulty": "fácil"},
    {"id": 14, "section": "Big Numbers", "question": "How do you write 31 in English?", "options": ["Thirty-one", "Thirteen", "Thirty", "Thirty-nine"], "correct_answer": 0, "difficulty": "fácil"},
    {"id": 15, "section": "Big Numbers", "question": "Write the number: forty.", "options": ["40", "14", "44", "24"], "correct_answer": 0, "difficulty": "fácil"},
    {"id": 16, "section": "Shopping and Quantities", "question": "Which is correct: a ___ of bananas?", "options": ["box", "bunch", "jar", "bag"], "correct_answer": 1, "difficulty": "fácil"},
    {"id": 17, "section": "Shopping and Quantities", "question": "Which is correct: a ___ of chocolates?", "options": ["box", "bunch", "jar", "bag"], "correct_answer": 0, "difficulty": "fácil"},
    {"id": 18, "section": "Shopping and Quantities", "question": "Which is correct: a ___ of apples?", "options": ["bag", "box", "jar", "bunch"], "correct_answer": 0, "difficulty": "fácil"},
    {"id": 19, "section": "Shopping and Quantities", "question": "Which is correct: a ___ of olives?", "options": ["jar", "box", "bag", "bunch"], "correct_answer": 0, "difficulty": "fácil"},
    {"id": 20, "section": "Shopping and Quantities", "question": "Which of these is a fruit?", "options": ["apple", "chocolate", "box", "jar"], "correct_answer": 0, "difficulty": "fácil"},
    {"id": 21, "section": "Shopping and Quantities", "question": "Which of these is a container?", "options": ["bag", "banana", "apple", "grape"], "correct_answer": 0, "difficulty": "fácil"},
    {"id": 22, "section": "Shopping and Quantities", "question": "What do you buy in a jar?", "options": ["olives", "bananas", "apples", "chocolates"], "correct_answer": 0, "difficulty": "fácil"},
    {"id": 23, "section": "Shopping and Quantities", "question": "What do you buy in a box?", "options": ["chocolates", "apples", "bananas", "olives"], "correct_answer": 0, "difficulty": "fácil"},
    {"id": 24, "section": "Shopping and Quantities", "question": "What do you buy in a bag?", "options": ["apples", "olives", "chocolates", "bananas"], "correct_answer": 0, "difficulty": "fácil"},
    {"id": 25, "section": "Shopping and Quantities", "question": "What do you buy in a bunch?", "options": ["bananas", "apples", "olives", "chocolates"], "correct_answer": 0, "difficulty": "fácil"},
    {"id": 26, "section": "Math Operations", "question": "What is 'plus' in math?", "options": ["+", "-", "x", "/"], "correct_answer": 0, "difficulty": "fácil"},
    {"id": 27, "section": "Math Operations", "question": "What is 'minus' in math?", "options": ["-", "+", "x", "/"], "correct_answer": 0, "difficulty": "fácil"},
    {"id": 28, "section": "Math Operations", "question": "What is 'times' in math?", "options": ["x", "+", "-", "/"], "correct_answer": 0, "difficulty": "fácil"},
    {"id": 29, "section": "Math Operations", "question": "What is 'divided by' in math?", "options": ["/", "+", "-", "x"], "correct_answer": 0, "difficulty": "fácil"},
    {"id": 30, "section": "Math Operations", "question": "What is 24 plus 18?", "options": ["42", "32", "38", "44"], "correct_answer": 0, "difficulty": "fácil"},
    {"id": 31, "section": "Math Operations", "question": "What is 9 minus 2?", "options": ["7", "6", "8", "9"], "correct_answer": 0, "difficulty": "fácil"},
    {"id": 32, "section": "Math Operations", "question": "What is 6 times 8?", "options": ["48", "36", "54", "56"], "correct_answer": 0, "difficulty": "fácil"},
    {"id": 33, "section": "Math Operations", "question": "What is 32 divided by 16?", "options": ["2", "4", "8", "16"], "correct_answer": 0, "difficulty": "fácil"},
    {"id": 34, "section": "Math Operations", "question": "What is the result of 32 + 18?", "options": ["50", "40", "60", "30"], "correct_answer": 0, "difficulty": "fácil"},
    {"id": 35, "section": "Math Operations", "question": "What is the result of 24 - 8?", "options": ["16", "18", "20", "14"], "correct_answer": 0, "difficulty": "fácil"},
    {"id": 36, "section": "Math Operations", "question": "What is the result of 6 x 8?", "options": ["48", "54", "36", "56"], "correct_answer": 0, "difficulty": "fácil"},
    {"id": 37, "section": "Math Operations", "question": "What is the result of 32 / 8?", "options": ["4", "8", "2", "6"], "correct_answer": 0, "difficulty": "fácil"},
    {"id": 38, "section": "How much? How many?", "question": "How much is this? $35", "options": ["Thirty-five dollars", "Thirty dollars", "Fifty-five dollars", "Twenty-five dollars"], "correct_answer": 0, "difficulty": "fácil"},
    {"id": 39, "section": "How much? How many?", "question": "How much is this? $62", "options": ["Sixty-two dollars", "Sixty dollars", "Twenty dollars", "Ninety dollars"], "correct_answer": 0, "difficulty": "fácil"},
    {"id": 40, "section": "How much? How many?", "question": "How much is this? $97", "options": ["Ninety-seven dollars", "Seventy-nine dollars", "Ninety dollars", "Seventy-seven dollars"], "correct_answer": 0, "difficulty": "fácil"},
    {"id": 41, "section": "How much? How many?", "question": "How many apples are there in the bag? (5)", "options": ["Five", "Fifteen", "Fifty", "Four"], "correct_answer": 0, "difficulty": "fácil"},
    {"id": 42, "section": "How much? How many?", "question": "How many bananas are there in the bunch? (7)", "options": ["Seven", "Seventeen", "Seventy", "Six"], "correct_answer": 0, "difficulty": "fácil"},
    {"id": 43, "section": "How much? How many?", "question": "How many chocolates are in the box? (12)", "options": ["Twelve", "Twenty", "Two", "Ten"], "correct_answer": 0, "difficulty": "fácil"},
    {"id": 44, "section": "How much? How many?", "question": "How many jars of olives are there? (3)", "options": ["Three", "Thirty", "Thirteen", "Thirty-three"], "correct_answer": 0, "difficulty": "fácil"},
    {"id": 45, "section": "How much? How many?", "question": "How many eggs are there? (36)", "options": ["Thirty-six", "Thirty", "Sixteen", "Thirty-nine"], "correct_answer": 0, "difficulty": "fácil"},